{"schema_version":"1.0","registry_version":"1.4.0","character":{"character_id":"pink_pig","display_name":"小粉飞猪","persona":["认真","冷静","略笨拙","不卖萌","冷幽默"]},"provenance":{"upstream_repo":"https://github.com/Jovifei/ian-fenzhu-illustrations","upstream_commit":"99ab94973b4d9b01d1f1ddb2737acf70c89b7c52","upstream_license":"MIT","local_path":"external/ian-fenzhu-illustrations","content_kind":"prompt_style_spec","note":"上游为 Prompt/风格规范 Skill 仓库，不含可用图集；图像资产来自本仓库自有资源"},"style_profile_ref":"src/factory/assets/pink_pig/style_profile.json","ip_constraints":{"must_have":["small_wings","round_snout_two_dots","dot_eyes","deadpan_serious"],"character_must_perform_core_action":true,"min_whitespace_ratio":0.35,"max_subject_ratio":0.6,"no_repeated_composition":true},"assets":[{"asset_id":"pink_pig.normal.v1","pose":"normal","moods":["calm","neutral"],"path":"assets/pink_pig/pig01.png","source_svg":"src/factory/assets/mascot/normal.svg","width":1080,"height":1920,"render_ready":true,"sha256":"e1cf5e3093a30be05f451b5c97d839d1d6d036fd452f7c4ab2a0c2232f09bd60","pose_confidence":"verified","tags":["idle","observe","education"]},{"asset_id":"pink_pig.thinking.v1","pose":"thinking","moods":["focused","curious"],"path":"assets/pink_pig/pig02.png","source_svg":"src/factory/assets/mascot/thinking.svg","width":1080,"height":1920,"render_ready":true,"sha256":"5bc65a04569a225d0f24a4f44461c00945a8c2a4f4ad880f67232b4e35737ae1","pose_confidence":"verified","tags":["observe","analyze","education","explain"]},{"asset_id":"pink_pig.repair.v1","pose":"repair","moods":["focused"],"path":"assets/pink_pig/pig03.png","source_svg":"src/factory/assets/mascot/repair.svg","width":1080,"height":1920,"render_ready":true,"sha256":"988bd3a4d15f960d2d8513d9c8924a4ac6a37b5b229e7282c62cc48e2d22a3a2","pose_confidence":"verified","tags":["fix","modify","repair"]},{"asset_id":"pink_pig.measure.v1","pose":"measure","moods":["focused"],"path":"assets/pink_pig/pig04.png","source_svg":"src/factory/assets/mascot/measure.svg","width":1080,"height":1920,"render_ready":true,"sha256":"8979cb3559e111e7bfc8edc47edc700ff51bd993bc34de236578c49b03bc645c","pose_confidence":"verified","tags":["check","evaluate","measure"]},{"asset_id":"pink_pig.success.v1","pose":"success","moods":["calm","positive"],"path":"assets/pink_pig/pig05.png","source_svg":"src/factory/assets/mascot/success.svg","width":1080,"height":1920,"render_ready":true,"sha256":"8aa8abdee1a4cc84bb793352e997be453d126b930ea9b253ab4ed55546489f1b","pose_confidence":"verified","tags":["complete","done","summary"]},{"asset_id":"pink_pig.question.v1","pose":"question","moods":["curious"],"path":null,"source_svg":"src/factory/assets/mascot/question.svg","width":1080,"height":1920,"render_ready":false,"sha256":"","fallback_asset_id":"pink_pig.normal.v1","pose_confidence":"verified","tags":["ask","clarify","explain"]},{"asset_id":"pink_pig.warning.v1","pose":"warning","moods":["caution"],"path":null,"source_svg":"src/factory/assets/mascot/warning.svg","width":1080,"height":1920,"render_ready":false,"sha256":"","fallback_asset_id":"pink_pig.normal.v1","pose_confidence":"verified","tags":["alert","notice","education","warning"]},{"asset_id":"pink_pig.ending.v1","pose":"ending","moods":["calm"],"path":null,"source_svg":"src/factory/assets/mascot/ending.svg","width":1080,"height":1920,"render_ready":false,"sha256":"","fallback_asset_id":"pink_pig.normal.v1","pose_confidence":"verified","tags":["finish","close","summary"]},{"asset_id":"pink_pig.knowledge_master_slave.v1","asset_role":"knowledge_illustration","pose":"normal","moods":["focused"],"path":"assets/modbus_rtu_illustrations/01-master-slave.png","source_svg":null,"width":1672,"height":941,"render_ready":true,"sha256":"9cae4c6973eb3be8a0df0b90deb8d2300f8a6cf4add3da71c0c8f25253bdaedf","pose_confidence":"verified","tags":["knowledge_illustration","modbus_rtu","master_slave","education","explain"]},{"asset_id":"pink_pig.knowledge_frame_layout.v1","asset_role":"knowledge_illustration","pose":"thinking","moods":["focused"],"path":"assets/modbus_rtu_illustrations/02-frame-layout.png","source_svg":null,"width":1672,"height":941,"render_ready":true,"sha256":"7bee0f4a766a254d11f8f2207b1fc8580360ef764d076bb54a04a8d7174feabc","pose_confidence":"verified","tags":["knowledge_illustration","modbus_rtu","frame_layout","education","protocol_frame","explain"]},{"asset_id":"pink_pig.knowledge_serial_parameters.v1","asset_role":"knowledge_illustration","pose":"measure","moods":["focused"],"path":"assets/modbus_rtu_illustrations/03-serial-parameters.png","source_svg":null,"width":1672,"height":941,"render_ready":true,"sha256":"69bdc5364cd81cb24a3615a1dbfe9f4d067e797573a5a38213fed7389c2a179a","pose_confidence":"verified","tags":["knowledge_illustration","modbus_rtu","serial_parameters","education","measure"]},{"asset_id":"pink_pig.knowledge_troubleshooting.v1","asset_role":"knowledge_illustration","pose":"repair","moods":["focused"],"path":"assets/modbus_rtu_illustrations/04-troubleshooting.png","source_svg":null,"width":1672,"height":941,"render_ready":true,"sha256":"e3f288680d759d3154e4089f3a81c2c8b16f60cbfa9946a56e2372f11fdf3980","pose_confidence":"verified","tags":["knowledge_illustration","modbus_rtu","troubleshooting","education","warning","repair"]},{"asset_id":"pink_pig.knowledge_summary.v1","asset_role":"knowledge_illustration","pose":"success","moods":["calm"],"path":"assets/modbus_rtu_illustrations/05-summary.png","source_svg":null,"width":1672,"height":941,"render_ready":true,"sha256":"78b49611e27786a3b231460f15f4cab28eb5b1e47c4aeb56ed91d562d0d1fe93","pose_confidence":"verified","tags":["knowledge_illustration","modbus_rtu","summary","education"]},{"asset_id":"pink_pig.knowledge_flash_window.v1","asset_role":"knowledge_illustration","pose":"normal","moods":["focused"],"path":"assets/flash_watchdog_illustrations/01-flash-window.png","source_svg":"assets/flash_watchdog_illustrations/01-flash-window.svg","width":1672,"height":941,"render_ready":true,"sha256":"b33941bb08714066e12d585b262d7aedcbdbdb6ece00b3e9e4503884251728d8","pose_confidence":"verified","tags":["knowledge_illustration","flash_watchdog","flash_window","education","explain"]},{"asset_id":"pink_pig.knowledge_erase_sequence.v1","asset_role":"knowledge_illustration","pose":"thinking","moods":["focused"],"path":"assets/flash_watchdog_illustrations/02-erase-sequence.png","source_svg":"assets/flash_watchdog_illustrations/02-erase-sequence.svg","width":1672,"height":941,"render_ready":true,"sha256":"a539887322be6e2e007b236873d6d97f927d29581777bc336e1f80301738a32e","pose_confidence":"verified","tags":["knowledge_illustration","flash_watchdog","erase_sequence","education","explain","protocol_frame"]},{"asset_id":"pink_pig.knowledge_watchdog_budget.v1","asset_role":"knowledge_illustration","pose":"measure","moods":["focused"],"path":"assets/flash_watchdog_illustrations/03-watchdog-budget.png","source_svg":"assets/flash_watchdog_illustrations/03-watchdog-budget.svg","width":1672,"height":941,"render_ready":true,"sha256":"88fb6fd359971c1318fbb913e24ca0e60441b1f5b676414271f84e4bd9b0bb09","pose_confidence":"verified","tags":["knowledge_illustration","flash_watchdog","watchdog_budget","education","measure"]},{"asset_id":"pink_pig.knowledge_recovery_path.v1","asset_role":"knowledge_illustration","pose":"repair","moods":["focused"],"path":"assets/flash_watchdog_illustrations/04-recovery-path.png","source_svg":"assets/flash_watchdog_illustrations/04-recovery-path.svg","width":1672,"height":941,"render_ready":true,"sha256":"4a357d2dfb5721ccfab339b92f8272dc25974e04ae7c5d8c97b65cb2c31958ed","pose_confidence":"verified","tags":["knowledge_illustration","flash_watchdog","recovery_path","education","warning","repair"]},{"asset_id":"pink_pig.knowledge_flash_checklist.v1","asset_role":"knowledge_illustration","pose":"success","moods":["calm"],"path":"assets/flash_watchdog_illustrations/05-checklist.png","source_svg":"assets/flash_watchdog_illustrations/05-checklist.svg","width":1672,"height":941,"render_ready":true,"sha256":"aa1a23a144f820f4d4be80f7fe813bc7db728c2718b82ddc60f1c2ee6d7cc8c1","pose_confidence":"verified","tags":["knowledge_illustration","flash_watchdog","checklist","education","summary"]},{"asset_id":"pink_pig.flash_watchdog_plain_window.v1","asset_role":"knowledge_illustration","pose":"normal","moods":["focused"],"path":"assets/flash_watchdog_plain_illustrations/01-flash-window.png","source_svg":"assets/flash_watchdog_plain_illustrations/01-flash-window.svg","width":1672,"height":941,"render_ready":true,"sha256":"c3cbd11171a6711c2dfe9ee70786561bfdf8a8136a78924573d717452daae44f","pose_confidence":"verified","tags":["knowledge_illustration","flash_watchdog","flash_watchdog_plain","flash_window","education","explain"]},{"asset_id":"pink_pig.flash_watchdog_plain_erase_sequence.v1","asset_role":"knowledge_illustration","pose":"thinking","moods":["focused"],"path":"assets/flash_watchdog_plain_illustrations/02-erase-sequence.png","source_svg":"assets/flash_watchdog_plain_illustrations/02-erase-sequence.svg","width":1672,"height":941,"render_ready":true,"sha256":"172363dd623668e3937132055ef6894074bd70b5b29598bc8f1d1dba6f623752","pose_confidence":"verified","tags":["knowledge_illustration","flash_watchdog","flash_watchdog_plain","erase_sequence","education","explain","protocol_frame"]},{"asset_id":"pink_pig.flash_watchdog_plain_budget.v1","asset_role":"knowledge_illustration","pose":"measure","moods":["focused"],"path":"assets/flash_watchdog_plain_illustrations/03-watchdog-budget.png","source_svg":"assets/flash_watchdog_plain_illustrations/03-watchdog-budget.svg","width":1672,"height":941,"render_ready":true,"sha256":"b4c0bcd29d7593fdba8d417342d1069ec0cf94134c7956f94a0179190c567870","pose_confidence":"verified","tags":["knowledge_illustration","flash_watchdog","flash_watchdog_plain","watchdog_budget","education","measure"]},{"asset_id":"pink_pig.flash_watchdog_plain_recovery.v1","asset_role":"knowledge_illustration","pose":"repair","moods":["fo